<?xml version="1.0" encoding="UTF-8"?>
<tns:elements xmlns:tns="http://www.example.org/page" xmlns:xsi="http://www.w3.org/2001/XMLSchema-instance" xsi:schemaLocation="http://www.example.org/page page.xsd ">
	<tns:element value="kw" by="id" id="百度首页-搜索框"/>
	<tns:element value="su" by="id" id="百度首页-搜索按钮"/>
	<tns:element value="ddl_game" by="id" id="测评游戏" />
	<tns:element value="ddl_mode" by="id" id="测评模式" />
	<tns:element value=".//*[@id='div_gpuTop']/div[1]/div[2]/div" by="xpath" id="测评得分"></tns:element>
	<tns:element value=".//*[@id='div_gpuTop']/div[1]/div[3]/div/a" by="xpath" id="测评显卡均价"></tns:element>
	<tns:element value="w760" by="class" id="MW-平板列表-苹果">
    	<tns:childElement value="dd" by="tagName" index="1">
      		<tns:childElement value="苹果" by="linkText"/>
    	</tns:childElement>
  </tns:element>
  <tns:list id="">
      <tns:element value="" by="id" id=""></tns:element>
  </tns:list>
</tns:elements>
 